{
  "$schema": "../../assets/ge_corpus.schema.json",
  "schema_version": 1,
  "semantic_boundary": "GE_RASTER_PIXEL_CONFORMANCE",
  "tracking_issue": 343,
  "cases": [
    {
      "case_id": "solid-triangle-8888-v1",
      "command_words": [
        "0x9c000000",
        "0x9d000010",
        "0xd2000003",
        "0x17000000",
        "0x1d000000",
        "0x1e000000",
        "0x1f000000",
        "0x20000000",
        "0x21000000",
        "0x22000000",
        "0x23000000",
        "0x24000000",
        "0x27000000",
        "0x28000000",
        "0x1280019c",
        "0x10000000",
        "0x01000000",
        "0x04030003",
        "0x0f000000",
        "0x0c000000"
      ],
      "relocations": [
        {"command_index": 15, "part": "BASE", "resource": "vertex_words"},
        {"command_index": 16, "part": "VADDR", "resource": "vertex_words"}
      ],
      "vertex_words": [
        "0xff0000ff", "0x40000000", "0x40000000", "0x00000000",
        "0xff0000ff", "0x41600000", "0x40000000", "0x00000000",
        "0xff0000ff", "0x40000000", "0x41600000", "0x00000000"
      ],
      "framebuffer": {
        "format": "8888",
        "width": 16,
        "height": 16,
        "stride_pixels": 16,
        "initial_pixel": 0
      },
      "selected_pixels": [
        {"x": 0, "y": 0, "pixel_value": null},
        {"x": 4, "y": 4, "pixel_value": null},
        {"x": 12, "y": 12, "pixel_value": null}
      ],
      "framebuffer_sha256": null,
      "source_tier": null,
      "evidence_envelope": null
    }
  ]
}
